{
  "schema_version": "dr-canary-execution-plan-v1.2",
  "provider": "zhipu-bigmodel",
  "model_id": "glm-5.3-flash",
  "endpoint": "https://open.bigmodel.cn/api/paas/v4/chat/completions",
  "channel": "ordinary_model_api",
  "text_only": true,
  "tools_enabled": false,
  "vision_enabled": false,
  "video_enabled": false,
  "files_enabled": false,
  "web_enabled": false,
  "parallel_enabled": false,
  "fallback_enabled": false,
  "max_provider_calls": 1,
  "max_retries": 0,
  "max_input_tokens": 512,
  "max_output_tokens": 256,
  "operation_timeout_seconds": 30,
  "run_deadline_seconds": 45,
  "monetary_budget_currency": "CNY",
  "monetary_budget_limit": "0.01",
  "pricing_type": "promotional",
  "input_price_per_million_tokens": "0.4",
  "output_price_per_million_tokens": "1.4",
  "approval_state": "user_authorized_single_call",
  "credential_environment_variable": "ZHIPUAI_API_KEY",
  "canary_attempt_id": "glm-5.3-flash-text-canary-003",
  "task_id": "dr-task-cccccccccccccccccccccccc",
  "brief_id": "dr-brief-dddddddddddddddddddddddd",
  "implementation_commit_sha": "a932f8c96f25765e2bd8181bc4c69bc13911155e",
  "runtime_source_sha256": "c69952ee4d77cb7a3d58ee96405e9c4ee9f55ffb3b0fe876df6db4ce16524327"
}
